,title,title_label,description,description_label
151, 카드로 스쿨뱅킹 자동납부 시  최대  만 원 캐시백,0,장길동  카드 마케팅본부장은  신종    바이러스로 인해 많은 어려움을 겪고 있는 고객에게 조금이나마 힘이 될 수 있도록 이벤트를 준비했다 며  앞으로도 고객 생활 전반에서 다양한 혜택을 제공할 수 있도록  ,1
152,이정영 전 금왕읍지역발전협의회장      극복 성금 전달,0, 중부매일 서인석 기자  이정영 전  금왕읍 지역발전협의회장이  일 금왕읍 행정복지센터를 방문      극복을 위해 써달라 며 상품권  만원을 기탁했다  이 전  금왕읍지역발전협의회장은     ,1
153,장덕초      대비 점심시간 칸막이  교실 도시락  운영,0,맞아     극복을 위해 최선을 다하고 있다 일 광주서부교육지원청에 따르면 장덕초등학교는 학생 수  여 명에 이르는 거대학교이다  장덕초에서는    로부터 학생들을 안전하게 지키기 위해 입실 전 발열  ,1
154,동국제약  야외활동 증가  진드기 기피제  디펜스벅스더블  쓰세요 ,0,최근    로 등산 캠핑 등 비대면 야외활동을 즐기는 사람이 증가함에 따라 진드기 매개 감염병에 대한 주의가 요구된다  환경부와 국립공원공단에 따르면 지난  월  일부터  월  일까지 북한산과 계룡산 등의  ,1
155, 홈쇼핑   소셜 임팩트 프로젝트  창업 특강 온라인 진행,0,특히 올해는 신종    바이러스 감염증으로 인한  생활속 거리두기 를 준수하고자  사회혁신 창업에 성공한 대표들의 이야기를 듣고 소통하는 특히  창업특강  프로그램을 온라인으로 전환해 진행하고 있다  특히  ,1
156,유은혜  등교  한 번은 반드시 겪어야 뒤쳐져 있을 수 없어 ,0,유은혜 사회부총리 겸 교육부 장관이  차 등교 이틀째를 맞아  신종    바이러스  감염증 상황 속에서 한  신종    바이러스 감염증    유행 속 교육부의 순차등교 방침에 따라 고등학교는 지난달  일  ,1
157,이정영 전 금왕읍지역발전협의회장      극복 성금 전달,0, 중부매일 서인석 기자  이정영 전  금왕읍 지역발전협의회장이  일 금왕읍 행정복지센터를 방문      극복을 위해 써달라 며 상품권  만원을 기탁했다  이 전  금왕읍지역발전협의회장은     ,1
158, 대신심 대용맹심 내어 빈틈없이 정진하라 ,0,한편  전국선원수좌회는     감염 예방에 동참하기 위해 경자년 하안거 결제일을 음력  월  일에서 윤달  월  일로 연기했다  이에 따라 경자년 하안거 결제는  월  일로  전국 선원에서는  여 명의 수좌가 석 달간의  ,1
159,안면온도 측정하는  로봇,1, 일 오후 서울 서초구청 입구에서 인공지능 로봇이 신종    바이러스 감염증   예방을 위해 청사 출입자들의 체온을 측정하고 있다  높이가 약   정도인  로봇은 적외선 카메라와 안면인식 기능을  ,1
160,전남도   국립난대수목원  유치 초석 투자협약 체결,0,김영록 전남도지사는  국립난대수목원 유치와 함께 블루투어 관광산업의 초석이 될 이번 호텔리조트 투자기업과 협약은    로 위축된 지역 관광산업에 활력을 불어넣을 것이다 며  전남에 투자한 것을  ,1
161,  올  분기에 세계 최초    글라스  선보인다,1,  엔리얼과 함께  글래스 온라인 앱  개발 세미나 개최  유플러스는    로 인한 언택트 시대에 맞춰 엔리얼과 함께  글래스 온라인 앱  개발 세미나를 개최한다   일 오전  시  분부터 한 시간 동안  ,1
162,서초구청 입구에 설치된 발열체크 로봇,1, 일 오후 서울 서초구청 입구에서 인공지능 로봇이 신종    바이러스 감염증   예방을 위해 청사 출입자들의 체온을 측정하고 있다  높이가 약   정도인  로봇은 적외선 카메라와 안면인식 기능을  ,1
163,일본 외무상  한국   제소에  결론은 안 나 무슨 생각일까 ,0,시 주석의 국빈 방일은 당초 올해  월로 예정됐다가 신종    바이러스 감염증    확산 여파로 연기됐습니다  그는 시 주석의 방일 시기에 대해  월로 예정된  주요  개국  정상회의가 먼저 오는 것은 틀림이  ,1
164,여수시  지역 문화예술단체에 지역상품권  만원 지원,0,전남 여수시는    의 장기화로 어려움을 겪고 있는 지역의 문화예술단체에  만원 상당의 여수사랑상품권을 지원한다고  일 밝혔다  지원대상은 고유번호증 또는 사업자등록증의 소재지가 여수이며   년부터  ,1
165, 년  민주항쟁이 울산에서 더 뜨거웠던 이유,1,울산기념사업위원회는    로 국가적 위기 속에 진행되는 민주항쟁 기념식이라 생활속  이어  아울러     이후 변화할 세상에서 가장 모범적인 방역과 극복으로 세울 새로운 이정표에 국민 모두와  ,1
166, 셀트리온    이상 상승    치료제 사업도 주목   유진투자증권   ,0,대해     항체 치료제를 개발 중인 셀트리온이 동물대상 효능 시험에서 의미 있는 결과를 도출      항체치료제도 개발 완료 후 글로벌 판매는 셀트리온헬스케어가 담당 이라고 분석하며  투자의견   ,1
167,과기정통부   다함께 디지털 세상으로 월은 정보문화의 달 ,1,올해는 신종    바이러스 감염증   으로 경제 사회분야 디지털 대전환이 가속화되는 상황 속 모든 구성원들이 빠짐없이 디지털 혜택을 누릴 수 있도록 하자는  디지털 포용 에 방점을 둬 행사가 기획됐다  ,1
168,거리두고 앉아 폴킴 공연보는 의료진들,0, 일 오후 서울 중랑구 서울의료원에서 열린  서울의료원 잠시멈춤 콘서트 에서 신종    바이러스 감염증    환자 진료를 위해 수고해 온 의료진들이 가수 폴 킴의 공연을 보고 있다   뉴스 ,1
169,똑똑한 로봇의 발열체크,1, 일 오후 서울 서초구청 입구에서 인공지능 로봇이 신종    바이러스 감염증   예방을 위해 청사 출입자들의 체온을 측정하고 있다  높이가 약   정도인  로봇은 적외선 카메라와 안면인식 기능을  ,1
170,문체부 식약처  스포츠 도핑방지와 불법 의약품 유통근절 협력,1,특히 최근    로 인해 도핑검사가 느슨해질 수 있다는 우려가 높은 상황이기 때문에 양 부처는 도핑 및 불법 의약품 유통 판매에 대한 단속을 강화하고  한국도핑방지위원회는 의심스러운 사례가 접수되는 경우 즉시  ,1
171,안면온도 측정하는  로봇,1, 일 오후 서울 서초구청 입구에서 인공지능 로봇이 신종    바이러스 감염증   예방을 위해 청사 출입자들의 체온을 측정하고 있다  높이가 약   정도인  로봇은 적외선 카메라와 안면인식 기능을  ,1
172,충남도  스타기업  개사 지정 현판식 개최,0,김용찬 행정부지사는    로 국내외 경제여건이 어려운 상황이지만  충남을 빛낼 스타기업으로 선정된 것에 자긍심을 갖고 지역경제 활성화를 위해 함께 노력해 달라 고 기업인들에게 당부하며   충남스타기업이  ,1
173, 금강전설  의왕시에 성금  만원 기탁,0,임현 에서    로 인해 어려움을 겪고 있는 저소득층을 위해 사용해 달라며  일 의왕시에 성금  만원을 기부했다  임현 대표는      로 더욱 어려움을 겪고 있는 저소득층과 함께 하고자 성금을 기탁하게 되었다  ,1
174,국내 첫 임상     백신 놓고  서 소송전,0,신종     백신 임상시험 중인 이노비오 백신 생산하는   상대  서 소송  백신 대량생산 정보 공개  신종     바이러스 백신을 둘러싸고 소송이 벌어졌다  개발회사인 이노비오가 백신 제조를 맡은 국내  ,1
175,마이다스에셋  아시아성장주펀드 목표수익 초과 달성,0,펀드 운용을 맡은 오남훈 주식운용 본부장은  펀드 설정 직후에     본격적인 확대  미중 무역분쟁 재점화 등으로 주식시장의 급등락이 있었지만  테크 업종 내에서도    와 미중 무역분쟁으로 일부 수혜를  ,1
176, 번가  전북 농특산물 기획전 연다 신동진 쌀 아리울 떡 할인,0,이상호  번가 사장은    의 장기화로 농산물 유통과 전반적인 소비심리가 위축된 상황에서 전라북도의 품질 좋은 상품들을 고객에게 선보이고 지역경제 활성화를 돕게 돼 뜻깊게 생각한다 며  판로 개척에  ,1
177,웰크론  케어온베이직마스크     승인,1,웰크론그룹 관계자는    가 전세계적으로 여전히 확산되고 있는 가운데  이번 케어온밸브마스크의  국내 및 각 국가의 요청에 빠르게 대응하여     예방에 적극 기여하는 기업이 되겠다 고 말했다 ,1
178,대학로 연극  리미트 에 배우 김민교 출연이 확정 ,0,연극  리미트 의 연출자로써  리미트 에 대한 애정과 사랑이 남다른 김민교는  연극을 통해    로 인해 지친 관객들에게 밝은 웃음과 긍정적인 에너지를 선물해주고 싶다 고 말했다   리미트 는 대학로  ,1
179, 생방송오늘저녁 파김치장어뚝배기 닭볶음탕 눈중풍,1,    극복   인 여름 보양식   우리 집 늦둥이  하이에나 남매   매운 꽃이 몸에 좋다  약이 되는 꽃     슬기로운 외식생활      극복   인 여름 보양식    에 예년보다 빨리 찾아온 더위로 지친 사람들을  ,1
180, 기자수첩  불평등 화두  심상정이 묻고 김종인이 답하다,0,   로 우리의 일상은 완전히 바뀌었다  경제 흐름과 정책  국가 기조는 이제 모두  포스트    에 초점이 맞춰졌다  이미 정부와 지자체는 한 차례 긴급재난지원금을 지급해 경제 활성화에 나섰다  하지만 정치권  ,1
181,청와대  과학기술 투자 강화해  기술 역량 기반한 글로벌 선도형 경제 만들 ,0,포스트     시대를 대비해 우리 경제를 글로벌 선도형 경제로 변화하기 위해 앞으로도 과학기술을  포스트     시대 경제위기 극복방안으로 제시한  선도형 경제  실현 가능성을 상징적으로 보여줬다는데  ,1
182,괴산 청천푸른내상인협동조합  시장내에  버섯한끼  운영,0,그러면서  많은 분들이 오셔서 버섯이 들어간 색다른 건강 분식을 맛보시고  빼어난 자연경관을 자랑하는 괴산에서    로 지친 심신을 치유하는 기회도 가져 보시기 바란다 고 당부했다 ,1
183,국회 원구성 협상 난항  속타는 청와대,0,우려      차 팬데믹 대비 질병관리청 승격도 시급  협치 당부  문 대통령 개원 연설도 미뤄질 듯  대 국회 원구성 협상이 난항을 겪으면서 청와대가 속을 태우고 있다  원구성이 늦어지면     국난극복을 위해  ,1
184,세정그룹      의료진 응원  덕분에 챌린지  캠페인 동참,0,패션기업 세정그룹은 지난달  일     치료와 확산 방지를 위해 힘쓰는 대한민국 모든 의료진에 대한  박순호 세정 회장은    를 극복하기 위해 신속한 대처로 앞장서고 있는 정부 관계자와 밤낮없이 헌신하는  ,1
185,식약처 문체부  스포츠 도핑방지 및 불법 의약품 유통근절 협력,1,최근    로 인한 도핑검사가 느슨해질 수 있다는 우려가 높은 상황이기 때문에 양 부처는 도핑 및 불법 의약품 유통 판매에 대한 단속을 강화하고  의심스러운 사례에 대한 즉각적 표적검사 실시 등 강력하게 조치해  ,1
186,조봉환 소진공 이사장  임직원과  전통시장 소비 활성화  구슬땀,1,인해    로 큰 타격을 입었던 전통시장에 서서히 활기가 돌고 있다 며  이 활기가 계속 이어질 수 있도록 지속적인 관심이 필요하다 고 말했다  이에 대해 조 이사장은  전국 전통시장이    로 매우 힘든 시기를  ,1
187,대구 상원중학교 학생     신규 확진 인후염 관련증상 보여,0,출처   온라인커뮤니티 대구 달서구에 위치한 상원중학교 학생 한 명이     확진 판정을 받았다  이로써 대구지역     확진 환자가  명 추가됐다   일 대구시와 중앙방역대책본부 등에 따르면 이날 오전 달서구  ,1
188, 기능 탑재된 로봇  발열체크,1, 일 오후 서울 서초구청 입구에서 인공지능 로봇이 신종    바이러스 감염증   예방을 위해 청사 출입자들의 체온을 측정하고 있다  높이가 약   정도인  로봇은 적외선 카메라와 안면인식 기능을  ,1
189,발열 체크하는  로봇,1, 일 오후 서울 서초구청 입구에서 인공지능 로봇이 신종    바이러스 감염증   예방을 위해 청사 출입자들의 체온을 측정하고 있다  높이가 약   정도인  로봇은 적외선 카메라와 안면인식 기능을  ,1
190,이상직  민주당 전북도당위원장 합의추대에 공감,1,이상직 의원은     등으로 국난 극복이 최대 이슈가 된 상황에서 경선보다는 합의 추대를 통한 선출방식이 좋겠다는 의견에 뜻을 같이했다 고 말했다  민주당 도당 위원장직에는 전주을 이상직 의원과 전주병  ,1
191,조봉환  시장 방문객 많이 늘어나 모바일상품권 장보기,1,조 이사장은  전국의 전통시장이    로 매우 힘든 시기를 보냈는데  월부터 최근까지 전통시장  여곳을 돌아보니 실제로 방문객들이 많이 늘어난 모습이었다 며  앞으로 대한민국 동행세일과 같은 공동 마케팅  ,1
192, 발열체크도 스마트하게 ,1, 일 오후 서울 서초구청 입구에서 인공지능 로봇이 신종    바이러스 감염증   예방을 위해 청사 출입자들의 체온을 측정하고 있다  높이가 약   정도인  로봇은 적외선 카메라와 안면인식 기능을  ,1
193,화성도시공사  실내 외 공공시설 개방운영 중단,0,공공시설을    의 수도권 집단 발생에 따라 오는  월  일까지 운영을 일시 중단하기로 했다  금번  이용중단 기간은 향후     상황에 따라 연장될 수 있으며  재개장 일정은 관련 부처 지침 및 지자체 지역 감염  ,1
194,인천 개척 교회 관련 확진자  명 등  명 추가 감염,0,인천시는 미추홀구 거주자인  살   씨와 연수구에 사는 목사  살   씨가       확진 판정을 받았다고 밝혔습니다    씨는 개척교회 집단 감염으로 양성 판정을 받은 미추홀구 목사와 지난달  일부터 세 차례 같이  ,1
195, 더벨 우리종금      반사이익  쏠쏠 ,1,우리종합금융이     사태 반사이익을 누리고 있다  은행권에서 신규대출을 보수적으로 관리하면서  앞서  월    가 확산할 무렵 우리종금은  억원 가량의 유동성을 확보했다  다음 달부터 본격적으로 이  ,1
196, 생명존중 강조하셨던 무산 스님 혜안 더욱 그립습니다 ,0,무산스님  주기 다례재는     확산 방지를 위해  월 일에서  월 일로 한 달 연기해 봉행됐다  이날  주기 다례재에는 조계종 전계대화상 성우 스님을 비롯해 원로의원 원행  동화사 회주 의현  화암사 회주 정휴  전  ,1
197,안산시  선제적 방역활동으로 지역사회 확산방지 총력,1, 안산시가 수도권을 중심으로    집단 감염이 산발적으로 발생하고 있는 가운데 모든 행정력을  내     방역부스 를 별도 설치해 방역 및 생활 수칙에 대한 홍보 현수막을 게시하고 마스크 등 방역물품을  ,1
198,  김해에 제 데이터센터 건립한다,0, 은 자체 보유한 통합 클라우드 서비스  의 사업 확대와 함께  포스트     시대로 본격화된 디지털 전환으로 클라우드 수요 급증이 예상됨에 따라  의 데이터 수용 능력을 넘어선 새로운  데이터  ,1
199,안성시      추경  억 원 예산 긴급 편성,0,안성시청 전경  안성시는    로 피해를 입은 소상공인들의 경영 안정을 위해 긴급 생활안정자금을 지급위해     추경을 통해  억 원의 예산을 긴급 편성했다  시에 따르면  년  월 대비  년  월  ,1
200,일본 전범기업 자산 현금화 본격화 한일관계 우려 커져,0,특히 요즘에는 한일 양국이 모두 신종    바이러스 감염증    확산에 대응하느라 강제징용 해법 찾기를 사실상 중단한 분위기다  더구나 최근 일본이 수출규제 조치를 취소하지 않으면서 갈등이 고조되는  ,1
201,오산시 드림스타트   칼림바 익히기  프로그램 실시  ,1,칼림바는 맑고 청아한 소리가 나며 악보집만으로도 손쉽게 익힐 수 있어 요즘     취미생활로 인기가 많은 악기다  프로그램 운영은 드림스타트 아동과 부모에게 일주일 단위로 연주곡 미션을 주고 악보집의  ,1
202,인천 미추홀구   작은극장돌체  학산소극장 공연 인터넷으로 공개,0,    여파로 무관중으로 진행된 올해 첫 공연은 작은극장돌체의  최용민의 재즈스토리 와 학산소극장의  김정식 미추홀구청장은     상황이 빨리 끝나 문화예술 공연을 직접 관람할 수 있는 날이 곧 오길  ,1
203, 전자 산학연 협의체  원팀  합류,0,우선     확산방지를 위해  의 통신 데이터와 감염병 확산방지 노하우에  의 통신 및 로밍   원팀은    와 같은 감염병 외에도 환경오염  산업안전 등 사회문제 해결에  를 적극적으로 활용할  ,1
204,창업진흥원   스타트업 이슈 트렌드 매주 카드뉴스로 제공,0,스타트업 주간 이슈 리포트는     등 급변하는 스타트업 생태계를 주기적으로 모니터링해 적시성  트렌드 와  포스트     시대 국내외 스타트업 정책  등 다양한 주제를 기획해 선보일 예정이다  이순배  ,1
205,보청기  구입보다 사후관리가 더 중요,0,스타키라이프에서는 신제품 보청기  착용시 전혀 보이지 않는 초소형 고막형 보청기  인공지능 보청기를 일 무료체험 할 수 있는 기회를 제공하고 있으며    로 어려운 시기 함께 극복하고자 한쪽 구입 시   양쪽  ,1
206, 더벨 저축은행  중기 리테일 가파른 성장,1,    사태 속에서 빠르게 몸집을 키웠지만 건전성 지표는 되레 개선될 만큼 우량해졌다는 평가다  여기에     사태 여파로 캐피탈사에서 대출이 어려워진 중기 고객들이 저축은행으로 발길을  ,1
207,재고 면세품 팔아도 깜깜 면세점업계 유급휴직 확산,1,면세점업계가     여파에 유급휴직을 확대하고 있다      장기화로 매출이 회복될 기미를 보이지 않는 만큼 인건비 절감에 나선 것으로 분석된다   일 업계에 따르면 신라면세점은 이달 중순부터 서울 본점  ,1
208,오산시환경보전시민위원단 오산남부장애인주간보호센터  장애인 복지 증진 위 ,0,박미순 회장은    로 온 국민이 어려움을 겪고 있는 시기에 역설적이게도 멍들은 지구는 되살아나고 생물은 더욱 활기차게 생동하고 있다 며   더 이상 지구가 인간의 전유물이 아니라는 것을 인식하고 환경을  ,1
209,오산시  오산지역화폐  한국의 가장 사랑받는 브랜드 대상  수상  ,1,곽상욱 오산시장은    로 침체된 지역경제 활성화를 위해 지역 내 소비를 촉진하고 소상공인 및 영세 자영업자에게 활력을 불어 넣는 계기가 됐으면 한다 며   이번 대상 수상을 계기로 앞으로도 더 사랑받는  ,1
210,서울시  포스트     이끌 바이오 언택트 유망기업 글로벌 세일즈,0,서울시는  일 온라인 국제회의   글로벌 서밋  에서  포스트     시대를 이끌 서울의 유망   포스트     시대 새로운 산업 모델이 될 우리 기업의 잠재력을 확인할 수 있을 것으로 기대했다  ,1
211,오산사회적경제협의회      취약계층 물품 지원나서,1,오산사회적경제협의회가     취약계층에게 물품 지원 협약을 체결하고 기념촬영을 하고 있다   오산사회적경제협의회 회장 이규희 가    로 어려움을 겪고 있는 지역 취약계층 지원을 위해 오산시  개동  ,1
212, 군위 자두빵   순천만 갈대 업싸이클   로컬 크리에이터  됐다,1,신종     바이러스 감염증   로 지역 간 이동마저 자유롭지 않아 경제적으로 더욱 어려운 요즘 그동안 지역의 특성을 살려 곳곳에 숨어 있는 아름다운 자연과 문화를 상품화해 주목을 받았던 지역 창업자들이  ,1
213,심상정  슈퍼여당 독주는 독배 협력정치 해야 해 ,1,통합당을 향해서는     재난의 엄중한 시기에 나치와 독재를 운운하며 또 보이콧 카드를 만지작거리는 것은 국민의 바람과 거꾸로 가는 것 이라고 지적했다  아울러  보이콧이  대에도 반복된다면 통합당은 국민에게  ,1
214,이천시  순번대기 로비 확장으로 시민호응 커,0,특히  더워지는 날씨와    의 확산에 따른 생활 속 거리두기의 일환으로 민원인의 접촉을 최소화하고   여가지의 다양한 화초와 녹색식물이 가득하여 종합민원실을 찾는 시민들의 심미적인 안정감까지 주고 있다  ,1
215, 일관성 있는 보안 정책의 핵심 키는 자동화 ,0,매튜 글리처   아태지역 보안사업부 총괄 부사장 매튜 부사장은     사태를 겪으면서 기업  교육  조사에 따르면 지난 몇 달간 해커들의 공격이    를 계기로 바뀐 생활상을 고려한 전술을 구사하는 모습이  ,1
216,이천라이온스클럽  사랑의 국수 마스크 전달,1,      확산 방지를 위해 경제적으로 어려움을 겪고 있는 취약계층에게 도움이 되길 바란다 고 말했다  이춘석 창전동장은      로 기부 활동이 위축되고 있는 상황에 관내 어르신과 취약계층이 건강하게 지낼  ,1
217,일본 전범기업 자산 현금화 본격화 한일관계 우려 커져,0,특히 요즘에는 한일 양국이 모두 신종    바이러스 감염증    확산에 대응하느라 강제징용 해법 찾기를 사실상 중단한 분위기다  더구나 최근 일본이 수출규제 조치를 취소하지 않으면서 갈등이 고조되는  ,1
218, 일관성 있는 보안 정책의 핵심 키는 자동화 ,0,매튜 글리처   아태지역 보안사업부 총괄 부사장 매튜 부사장은     사태를 겪으면서 기업  교육  조사에 따르면 지난 몇 달간 해커들의 공격이    를 계기로 바뀐 생활상을 고려한 전술을 구사하는 모습이  ,1
219,창업진흥원   스타트업 이슈 트렌드 매주 카드뉴스로 제공,0,스타트업 주간 이슈 리포트는     등 급변하는 스타트업 생태계를 주기적으로 모니터링해 적시성  트렌드 와  포스트     시대 국내외 스타트업 정책  등 다양한 주제를 기획해 선보일 예정이다  이순배  ,1
220,재고 면세품 팔아도 깜깜 면세점업계 유급휴직 확산,1,면세점업계가     여파에 유급휴직을 확대하고 있다      장기화로 매출이 회복될 기미를 보이지 않는 만큼 인건비 절감에 나선 것으로 분석된다   일 업계에 따르면 신라면세점은 이달 중순부터 서울 본점  ,1
221, 내포 충남도  마스크 하루  만장 생산 공장 유치,0,양 지사는     인해 지금도 마스크 수급이 원활하지는 않지만  톱텍에서 본격적으로 마스크 생산이 시작되면 도내 안정적인 마스크 수급에도 많은 도움이 되고  공적마스크 외에 충남도 자체 비축물량  만장  ,1
222,오산시  오산지역화폐  한국의 가장 사랑받는 브랜드 대상  수상  ,1,곽상욱 오산시장은    로 침체된 지역경제 활성화를 위해 지역 내 소비를 촉진하고 소상공인 및 영세 자영업자에게 활력을 불어 넣는 계기가 됐으면 한다 며   이번 대상 수상을 계기로 앞으로도 더 사랑받는  ,1
223, 더벨 카카오뱅크의  아무도 가보지 않은 길 ,0,언택트 비즈니스로 분류되는 만큼 포스트     시대에 성장 잠재력이 무궁무진하기도 하다  지점 하나 없이 모바일 플랫폼만으로 금융서비스가 원활히 제공될 수 있음을 입증했다  카카오뱅크가 만들어 놓을  의  ,1
224, 더벨 우리종금      반사이익  쏠쏠 ,1,우리종합금융이     사태 반사이익을 누리고 있다  은행권에서 신규대출을 보수적으로 관리하면서  앞서  월    가 확산할 무렵 우리종금은  억원 가량의 유동성을 확보했다  다음 달부터 본격적으로 이  ,1
225,충남도  하루  만장 생산 규모 마스크 공장 유치,0,양승조 충남지사는  신종    바이러스 감염증   으로 인해 지금도 마스크 수급이 원활하지는 않지만 톱텍에서 본격적으로 마스크 생산이 시작되면 도내 안정적인 마스크 수급에도 많은 도움이 되고  ,1
